{
  "$schema": "https://json-schema.org/draft/2020-12/schema",
  "title": "P0-v1 exact candidate decision receipts",
  "type": "object",
  "additionalProperties": false,
  "required": [
    "$schema",
    "schema_version",
    "artifact_type",
    "artifact_id",
    "decision_receipts",
    "resolution_candidate_set_binding",
    "authority"
  ],
  "properties": {
    "$schema": {
      "const": "./p0-decision-receipts-v1.schema.json"
    },
    "schema_version": {
      "const": "1.0.0"
    },
    "artifact_type": {
      "const": "P0_REVISION_CANDIDATE_DECISION_RECEIPT_SET"
    },
    "artifact_id": {
      "const": "INTERP-DIALOGUE-001P0-V1-DECISION-RECEIPTS"
    },
    "decision_receipts": {
      "type": "array",
      "minItems": 18,
      "items": {
        "type": "object",
        "additionalProperties": false,
        "required": [
          "decision_receipt_id",
          "resolution_candidate_id",
          "decision",
          "applied_operation_ids",
          "decision_basis",
          "execution_status",
          "semantic_preservation_claim",
          "authority"
        ],
        "properties": {
          "decision_receipt_id": {
            "$ref": "#/$defs/token"
          },
          "resolution_candidate_id": {
            "$ref": "#/$defs/token"
          },
          "decision": {
            "enum": [
              "ACCEPTED",
              "REJECTED",
              "DEFERRED"
            ]
          },
          "applied_operation_ids": {
            "type": "array",
            "items": {
              "$ref": "#/$defs/token"
            }
          },
          "decision_basis": {
            "$ref": "#/$defs/nonEmptyString"
          },
          "execution_status": {
            "enum": [
              "ADOPTED_IN_FROZEN_P0_V1_NOT_REPILOTED",
              "REJECTED_NOT_APPLIED",
              "DEFERRED_NOT_APPLIED"
            ]
          },
          "semantic_preservation_claim": {
            "const": "NONE"
          },
          "authority": {
            "const": "P0_VERSION_DECISION_ONLY"
          }
        }
      }
    },
    "resolution_candidate_set_binding": {
      "$ref": "#/$defs/binding"
    },
    "authority": {
      "const": "P0_DECISIONS_NO_DEFECT_RESOLUTION_CLAIM"
    }
  },
  "$defs": {
    "nonEmptyString": {
      "type": "string",
      "minLength": 1
    },
    "token": {
      "type": "string",
      "pattern": "^[A-Za-z0-9][A-Za-z0-9._:-]*$"
    },
    "sha256": {
      "type": "string",
      "pattern": "^[0-9a-f]{64}$"
    },
    "stringArray": {
      "type": "array",
      "items": {
        "type": "string"
      }
    },
    "binding": {
      "type": "object",
      "additionalProperties": false,
      "required": [
        "artifact_id",
        "path",
        "content_sha256"
      ],
      "properties": {
        "artifact_id": {
          "$ref": "#/$defs/nonEmptyString"
        },
        "path": {
          "$ref": "#/$defs/nonEmptyString"
        },
        "content_sha256": {
          "$ref": "#/$defs/sha256"
        }
      }
    }
  }
}
