{
  "$schema": "./p0-decision-receipts-v1.schema.json",
  "schema_version": "1.0.0",
  "artifact_type": "P0_REVISION_CANDIDATE_DECISION_RECEIPT_SET",
  "artifact_id": "INTERP-DIALOGUE-001P0-V1-DECISION-RECEIPTS",
  "resolution_candidate_set_binding": {
    "artifact_id": "INTERP-DIALOGUE-001P0-V1-RESOLUTION-CANDIDATES",
    "path": "research/scenarios/interp-dialogue-001/elicitation/p0-v1/revision-resolution-candidates-v1.json",
    "content_sha256": "8e94d0ae86055df8ec37e57d300720e607c966ec03f32b4c839d2efc6618dc0d"
  },
  "authority": "P0_DECISIONS_NO_DEFECT_RESOLUTION_CLAIM",
  "decision_receipts": [
    {
      "decision_receipt_id": "DEC-RP001-REL",
      "resolution_candidate_id": "RC-RP001-REL",
      "decision": "ACCEPTED",
      "applied_operation_ids": [
        "OP-RC-RP001-REL-01",
        "OP-RC-RP001-REL-02"
      ],
      "decision_basis": "Accepted as an exact development-instrument revision for P0-v1; the resulting surface remains unexecuted and must be re-inspected under a separately preregistered P1-v1.",
      "execution_status": "ADOPTED_IN_FROZEN_P0_V1_NOT_REPILOTED",
      "semantic_preservation_claim": "NONE",
      "authority": "P0_VERSION_DECISION_ONLY"
    },
    {
      "decision_receipt_id": "DEC-RP001-WORK",
      "resolution_candidate_id": "RC-RP001-WORK",
      "decision": "ACCEPTED",
      "applied_operation_ids": [
        "OP-RC-RP001-WORK-01",
        "OP-RC-RP001-WORK-02"
      ],
      "decision_basis": "Accepted as an exact development-instrument revision for P0-v1; the resulting surface remains unexecuted and must be re-inspected under a separately preregistered P1-v1.",
      "execution_status": "ADOPTED_IN_FROZEN_P0_V1_NOT_REPILOTED",
      "semantic_preservation_claim": "NONE",
      "authority": "P0_VERSION_DECISION_ONLY"
    },
    {
      "decision_receipt_id": "DEC-RP001-RISK",
      "resolution_candidate_id": "RC-RP001-RISK",
      "decision": "ACCEPTED",
      "applied_operation_ids": [
        "OP-RC-RP001-RISK-01",
        "OP-RC-RP001-RISK-02"
      ],
      "decision_basis": "Accepted as an exact development-instrument revision for P0-v1; the resulting surface remains unexecuted and must be re-inspected under a separately preregistered P1-v1.",
      "execution_status": "ADOPTED_IN_FROZEN_P0_V1_NOT_REPILOTED",
      "semantic_preservation_claim": "NONE",
      "authority": "P0_VERSION_DECISION_ONLY"
    },
    {
      "decision_receipt_id": "DEC-RP002-PARTNER",
      "resolution_candidate_id": "RC-RP002-PARTNER",
      "decision": "ACCEPTED",
      "applied_operation_ids": [
        "OP-RC-RP002-PARTNER-01"
      ],
      "decision_basis": "Accepted as an exact development-instrument revision for P0-v1; the resulting surface remains unexecuted and must be re-inspected under a separately preregistered P1-v1.",
      "execution_status": "ADOPTED_IN_FROZEN_P0_V1_NOT_REPILOTED",
      "semantic_preservation_claim": "NONE",
      "authority": "P0_VERSION_DECISION_ONLY"
    },
    {
      "decision_receipt_id": "DEC-RP003-SMALL-CARE",
      "resolution_candidate_id": "RC-RP003-SMALL-CARE",
      "decision": "ACCEPTED",
      "applied_operation_ids": [
        "OP-RC-RP003-SMALL-CARE-01"
      ],
      "decision_basis": "Accepted as an exact development-instrument revision for P0-v1; the resulting surface remains unexecuted and must be re-inspected under a separately preregistered P1-v1.",
      "execution_status": "ADOPTED_IN_FROZEN_P0_V1_NOT_REPILOTED",
      "semantic_preservation_claim": "NONE",
      "authority": "P0_VERSION_DECISION_ONLY"
    },
    {
      "decision_receipt_id": "DEC-RP003-DISTANCE",
      "resolution_candidate_id": "RC-RP003-DISTANCE",
      "decision": "ACCEPTED",
      "applied_operation_ids": [
        "OP-RC-RP003-DISTANCE-01"
      ],
      "decision_basis": "Accepted as an exact development-instrument revision for P0-v1; the resulting surface remains unexecuted and must be re-inspected under a separately preregistered P1-v1.",
      "execution_status": "ADOPTED_IN_FROZEN_P0_V1_NOT_REPILOTED",
      "semantic_preservation_claim": "NONE",
      "authority": "P0_VERSION_DECISION_ONLY"
    },
    {
      "decision_receipt_id": "DEC-RP004-NO-INCIDENT",
      "resolution_candidate_id": "RC-RP004-NO-INCIDENT",
      "decision": "ACCEPTED",
      "applied_operation_ids": [
        "OP-RC-RP004-NO-INCIDENT-01"
      ],
      "decision_basis": "Accepted as an exact development-instrument revision for P0-v1; the resulting surface remains unexecuted and must be re-inspected under a separately preregistered P1-v1.",
      "execution_status": "ADOPTED_IN_FROZEN_P0_V1_NOT_REPILOTED",
      "semantic_preservation_claim": "NONE",
      "authority": "P0_VERSION_DECISION_ONLY"
    },
    {
      "decision_receipt_id": "DEC-RP005-ORDINARY",
      "resolution_candidate_id": "RC-RP005-ORDINARY",
      "decision": "ACCEPTED",
      "applied_operation_ids": [
        "OP-RC-RP005-ORDINARY-01"
      ],
      "decision_basis": "Accepted as an exact development-instrument revision for P0-v1; the resulting surface remains unexecuted and must be re-inspected under a separately preregistered P1-v1.",
      "execution_status": "ADOPTED_IN_FROZEN_P0_V1_NOT_REPILOTED",
      "semantic_preservation_claim": "NONE",
      "authority": "P0_VERSION_DECISION_ONLY"
    },
    {
      "decision_receipt_id": "DEC-RP005-LOW",
      "resolution_candidate_id": "RC-RP005-LOW",
      "decision": "ACCEPTED",
      "applied_operation_ids": [
        "OP-RC-RP005-LOW-01"
      ],
      "decision_basis": "Accepted as an exact development-instrument revision for P0-v1; the resulting surface remains unexecuted and must be re-inspected under a separately preregistered P1-v1.",
      "execution_status": "ADOPTED_IN_FROZEN_P0_V1_NOT_REPILOTED",
      "semantic_preservation_claim": "NONE",
      "authority": "P0_VERSION_DECISION_ONLY"
    },
    {
      "decision_receipt_id": "DEC-RP006-REL-ORDINARY",
      "resolution_candidate_id": "RC-RP006-REL-ORDINARY",
      "decision": "ACCEPTED",
      "applied_operation_ids": [
        "OP-RC-RP006-REL-ORDINARY-01"
      ],
      "decision_basis": "Accepted as an exact development-instrument revision for P0-v1; the resulting surface remains unexecuted and must be re-inspected under a separately preregistered P1-v1.",
      "execution_status": "ADOPTED_IN_FROZEN_P0_V1_NOT_REPILOTED",
      "semantic_preservation_claim": "NONE",
      "authority": "P0_VERSION_DECISION_ONLY"
    },
    {
      "decision_receipt_id": "DEC-RP006-REL-LOW",
      "resolution_candidate_id": "RC-RP006-REL-LOW",
      "decision": "ACCEPTED",
      "applied_operation_ids": [
        "OP-RC-RP006-REL-LOW-01"
      ],
      "decision_basis": "Accepted as an exact development-instrument revision for P0-v1; the resulting surface remains unexecuted and must be re-inspected under a separately preregistered P1-v1.",
      "execution_status": "ADOPTED_IN_FROZEN_P0_V1_NOT_REPILOTED",
      "semantic_preservation_claim": "NONE",
      "authority": "P0_VERSION_DECISION_ONLY"
    },
    {
      "decision_receipt_id": "DEC-RP006-WORK-LOW",
      "resolution_candidate_id": "RC-RP006-WORK-LOW",
      "decision": "ACCEPTED",
      "applied_operation_ids": [
        "OP-RC-RP006-WORK-LOW-01"
      ],
      "decision_basis": "Accepted as an exact development-instrument revision for P0-v1; the resulting surface remains unexecuted and must be re-inspected under a separately preregistered P1-v1.",
      "execution_status": "ADOPTED_IN_FROZEN_P0_V1_NOT_REPILOTED",
      "semantic_preservation_claim": "NONE",
      "authority": "P0_VERSION_DECISION_ONLY"
    },
    {
      "decision_receipt_id": "DEC-RP006-WORK-HIGH",
      "resolution_candidate_id": "RC-RP006-WORK-HIGH",
      "decision": "ACCEPTED",
      "applied_operation_ids": [
        "OP-RC-RP006-WORK-HIGH-01"
      ],
      "decision_basis": "Accepted as an exact development-instrument revision for P0-v1; the resulting surface remains unexecuted and must be re-inspected under a separately preregistered P1-v1.",
      "execution_status": "ADOPTED_IN_FROZEN_P0_V1_NOT_REPILOTED",
      "semantic_preservation_claim": "NONE",
      "authority": "P0_VERSION_DECISION_ONLY"
    },
    {
      "decision_receipt_id": "DEC-RP006-RISK-LOW",
      "resolution_candidate_id": "RC-RP006-RISK-LOW",
      "decision": "ACCEPTED",
      "applied_operation_ids": [
        "OP-RC-RP006-RISK-LOW-01"
      ],
      "decision_basis": "Accepted as an exact development-instrument revision for P0-v1; the resulting surface remains unexecuted and must be re-inspected under a separately preregistered P1-v1.",
      "execution_status": "ADOPTED_IN_FROZEN_P0_V1_NOT_REPILOTED",
      "semantic_preservation_claim": "NONE",
      "authority": "P0_VERSION_DECISION_ONLY"
    },
    {
      "decision_receipt_id": "DEC-RP006-RISK-HIGH",
      "resolution_candidate_id": "RC-RP006-RISK-HIGH",
      "decision": "ACCEPTED",
      "applied_operation_ids": [
        "OP-RC-RP006-RISK-HIGH-01"
      ],
      "decision_basis": "Accepted as an exact development-instrument revision for P0-v1; the resulting surface remains unexecuted and must be re-inspected under a separately preregistered P1-v1.",
      "execution_status": "ADOPTED_IN_FROZEN_P0_V1_NOT_REPILOTED",
      "semantic_preservation_claim": "NONE",
      "authority": "P0_VERSION_DECISION_ONLY"
    },
    {
      "decision_receipt_id": "DEC-RP007-PRESENTATION",
      "resolution_candidate_id": "RC-RP007-PRESENTATION",
      "decision": "ACCEPTED",
      "applied_operation_ids": [
        "OP-RC-RP007-PRESENTATION-01",
        "OP-RC-RP007-PRESENTATION-02"
      ],
      "decision_basis": "Accepted as an exact development-instrument revision for P0-v1; the resulting surface remains unexecuted and must be re-inspected under a separately preregistered P1-v1.",
      "execution_status": "ADOPTED_IN_FROZEN_P0_V1_NOT_REPILOTED",
      "semantic_preservation_claim": "NONE",
      "authority": "P0_VERSION_DECISION_ONLY"
    },
    {